{
  "$schema": "https://json-schema.org/draft/2020-12/schema",
  "$id": "./sdlc.schema.json",
  "title": "sdlc shared project configuration (.agents/sdlc.json)",
  "description": "Generated by `npm run config:docs` from lib/config-schema.mjs. Do not hand-edit; see docs/configuration.md.",
  "type": "object",
  "properties": {
    "$schema": {
      "type": "string",
      "description": "Path to the JSON Schema file, for editor validation; has no effect on pipeline behavior.",
      "default": null
    },
    "version": {
      "type": "integer",
      "description": "Schema version for `.agents/sdlc.json`; only `1` is recognized today."
    },
    "targets": {
      "type": "array",
      "items": {
        "type": "object",
        "properties": {
          "name": {
            "type": "string",
            "pattern": "^[a-z][a-z0-9-]*$",
            "description": "Lane identifier; must match /^[a-z][a-z0-9-]*$/ and be unique among targets."
          },
          "paths": {
            "type": "array",
            "items": {
              "type": "string",
              "pattern": "\\S"
            },
            "description": "Glob patterns whose changed files belong to this target.",
            "default": []
          },
          "gates": {
            "type": "array",
            "items": {
              "type": "string",
              "pattern": "\\S"
            },
            "description": "Quality-gate commands run in addition to the top-level gates when this target is selected.",
            "default": []
          },
          "reviewers": {
            "type": "array",
            "items": {
              "type": "string"
            },
            "description": "Reviewer profiles for this target; inherits the top-level reviewers when omitted."
          }
        },
        "required": [
          "name"
        ],
        "additionalProperties": false
      },
      "description": "Ordered list of named work lanes; declaration order sets precedence when target paths overlap."
    },
    "gates": {
      "type": "array",
      "items": {
        "type": "string",
        "pattern": "\\S"
      },
      "description": "Quality-gate commands run for every target.",
      "default": []
    },
    "reviewers": {
      "type": "array",
      "items": {
        "type": "string"
      },
      "description": "Default reviewer profiles for targets that do not declare their own.",
      "default": []
    },
    "productDocs": {
      "type": "string",
      "description": "Repository-relative directory of durable product documentation.",
      "default": "thoughts/docs/"
    },
    "frontendConstraints": {
      "type": "string",
      "description": "Prose constraints frontend reviewers and implementers must honor.",
      "default": "none"
    },
    "beads": {
      "type": "object",
      "properties": {
        "mode": {
          "type": "string",
          "enum": [
            "embedded",
            "server"
          ],
          "description": "Beads coordination backend: an embedded local store or a shared server.",
          "default": "embedded"
        },
        "mergeSlot": {
          "type": "string",
          "enum": [
            "off",
            "on"
          ],
          "description": "Whether the single-writer merge slot is enforced before landing.",
          "default": "off"
        }
      },
      "additionalProperties": false
    },
    "local": {
      "type": "object",
      "properties": {
        "reviewEditor": {
          "type": "string",
          "description": "Command template that opens a worktree in the developer's editor; machine-scoped.",
          "default": null
        },
        "preview": {
          "type": "object",
          "properties": {
            "command": {
              "type": "string",
              "description": "Command template that starts a local preview server; machine-scoped.",
              "default": null
            },
            "url": {
              "type": "string",
              "description": "URL template for the local preview server; machine-scoped.",
              "default": null
            }
          },
          "additionalProperties": false
        }
      },
      "additionalProperties": false
    },
    "models": {
      "type": "object",
      "properties": {
        "defaults": {
          "type": "object",
          "properties": {
            "tier": {
              "type": "string",
              "enum": [
                "frontier",
                "balanced",
                "cheap"
              ],
              "description": "Fallback model tier for roles that do not declare their own.",
              "default": "balanced"
            },
            "effort": {
              "type": "string",
              "enum": [
                "low",
                "medium",
                "high"
              ],
              "description": "Fallback reasoning effort for roles that do not declare their own.",
              "default": "medium"
            }
          },
          "additionalProperties": false
        },
        "roles": {
          "type": "object",
          "patternProperties": {
            "^[a-z][a-z0-9-]*$": {
              "type": "object",
              "properties": {
                "tier": {
                  "type": "string",
                  "enum": [
                    "frontier",
                    "balanced",
                    "cheap"
                  ],
                  "description": "Model tier for this role; falls back to models.defaults.tier."
                },
                "effort": {
                  "type": "string",
                  "enum": [
                    "low",
                    "medium",
                    "high"
                  ],
                  "description": "Reasoning effort for this role; falls back to models.defaults.effort."
                }
              },
              "additionalProperties": false
            }
          },
          "additionalProperties": false,
          "description": "Per-role tier/effort overrides; role names are open-ended.",
          "default": {}
        },
        "tiers": {
          "type": "object",
          "properties": {
            "claude": {
              "type": "object",
              "properties": {
                "frontier": {
                  "type": "string",
                  "pattern": "\\S",
                  "description": "Concrete model identifier a host resolves this tier to."
                },
                "balanced": {
                  "type": "string",
                  "pattern": "\\S",
                  "description": "Concrete model identifier a host resolves this tier to."
                },
                "cheap": {
                  "type": "string",
                  "pattern": "\\S",
                  "description": "Concrete model identifier a host resolves this tier to."
                }
              },
              "additionalProperties": false
            },
            "codex": {
              "type": "object",
              "properties": {
                "frontier": {
                  "type": "string",
                  "pattern": "\\S",
                  "description": "Concrete model identifier a host resolves this tier to."
                },
                "balanced": {
                  "type": "string",
                  "pattern": "\\S",
                  "description": "Concrete model identifier a host resolves this tier to."
                },
                "cheap": {
                  "type": "string",
                  "pattern": "\\S",
                  "description": "Concrete model identifier a host resolves this tier to."
                }
              },
              "additionalProperties": false
            },
            "pi": {
              "type": "object",
              "properties": {
                "frontier": {
                  "type": "string",
                  "pattern": "\\S",
                  "description": "Concrete model identifier a host resolves this tier to."
                },
                "balanced": {
                  "type": "string",
                  "pattern": "\\S",
                  "description": "Concrete model identifier a host resolves this tier to."
                },
                "cheap": {
                  "type": "string",
                  "pattern": "\\S",
                  "description": "Concrete model identifier a host resolves this tier to."
                }
              },
              "additionalProperties": false
            }
          },
          "additionalProperties": false,
          "description": "Per-host model identifiers for each tier.",
          "default": {}
        }
      },
      "additionalProperties": false
    }
  },
  "required": [
    "version",
    "targets"
  ],
  "additionalProperties": false
}
